"id","name","city","address","latitude","longitude","future_event_count","future_session_count"
"26e51817-1696-47a4-9dcd-4596743f1d20","Sahne Hane Üsküdar","İstanbul","Mimar Sinan, Selmani Pak Cd. No:48 2 D:1, 34672 Üsküdar/İstanbul","41.02507533","29.01933087","2","2"
"b2ee2bb7-df82-42b5-a073-54cfc2ebfda8","Sahne Leukai","İzmir","Ataşehir, 8229/1. Sk. No:58, 35630, 35630 Çiğli/İzmir","38.488714","27.052811","0","0"
"e24bc0ae-4977-4c54-a514-c9fbbce36cb9","Sahne Tozu Tiyatrosu Fehmi İşgören Sahnesi","İzmir","Mithatpaşa Cad. No:9 SSK Blokları E-1 Blok, Konak YKM\nKONAK / İzmir","38.41673052","27.12834192","0","0"
"50282fdb-1ead-49ee-ae2f-661c53dbc717","Sahne Tozu Tiyatrosu Göksel Kortay Sahnesi","İzmir","Akdeniz Mah, Şehit. Fethi Bey Cd. No:33, 35210 Konak/İzmir (Borsa Binası Yanı - Gümrük Durakları arkası)","38.42387806","27.13254176","0","0"
"d6d04d7b-3098-47f5-9c7b-d9bfeaab6e53","Sahne Tozu Tiyatrosu Haldun Dormen Sahnesi","İzmir","Mithatpaşa Cad. No:9 SSK Blokları E-1 Blok, Konak YKM\nKONAK / İzmir","38.41555791","27.12575108","0","0"
"50f6a6b3-8567-4056-bb32-295998358ba8","Sait Halim Paşa Yalısı","İstanbul","Sait Halim Paşa Yalısı, SARIYER, İstanbul, Türkiye","41.120511","29.069769","1","4"
"b3e4e3d2-c83a-4edf-813a-bd1f3e02ee47","Saklı Bahçe","İzmir","İnciraltı, Mustafa Kemal Sahil Blv. No:40, 35330 Narlıdere/İzmir","38.39699744","27.03358857","1","1"
"d83440fc-a31f-4581-87f3-f6513db2199e","Salihli Zafer Keskiner Şehir Tiyatrosu","Manisa","Atatürk, Belediye Cd. No:103, 45320 Salihli/Manisa","38.48743314","28.13956035","0","0"
"0481a801-f6f3-4794-b556-6aca1cf7ac07","Salon Alyans","Batman","Millet Bahçesi Karşısı, Bahçelievler Mahallesi Merkez / Batman","37.88953771","41.13591034","0","0"
"deffc8be-e62a-46f7-abfb-024c583b552f","Salon İKSV - İstanbul","İstanbul","İstanbul Kültür Sanat Vakfı Nejat Eczacıbaşı Binası Bereketzade Mahallesi Sadi Konuralp Caddesi, Şişhane Sk. No:5, 34433 Beyoğlu","41.028305","28.971647","1","1"
"f3a15b41-08c3-4d47-816e-e5485ba0e9e4","Salonda Sanat (Kavagan House)","İzmir","Yaka, İstikbal Cd. No:105, 35310 Güzelbahçe/İzmir","38.36788243","26.89242248","0","0"
"94c16fc6-d732-437b-a526-eef15d9ee835","Salt and Pepper","Eskişehir","Salt and Pepper Always Together, Hoşnudiye Cassaba Modern 770. Sk 4B, D:105, 26130 Tepebaşı Eskişehir","39.89728674","30.4262356","0","0"
"b10b4891-7273-4b7e-87c5-fb9a4ab01e21","Saltanat Sarayı","Kahramanmaraş","Oruç Reis, Av. Mehmet Alikisaürek Cd, 46040 K.Maraş Merkez/Kahramanmaraş","37.88524332","36.88390981","0","0"
"c9113961-a87a-4e89-af36-5a2c13e145eb","Samsun - Batıpark","Samsun","Kalkancı, 55100 İlkadım/Samsun","41.3236296040538","36.3199677592726","1","1"
"f3269e42-a9b6-4a71-8c98-8cf805724686","Samsun Büyükşehir Belediyesi Sanat Merkezi","Samsun","Samsun Büyükşehir Belediyesi Sanat Merkezi, ATAKUM, Samsun, Türkiye","41.330328","36.291287","3","3"
"1d665dd8-255a-4b70-83a9-48c74d02e50e","Samsun Doğu Park Amfi Tiyatro","Samsun","Samsun Doğu Park Amfi Tiyatro, CANİK, Samsun, Türkiye","41.2749810425592","36.3641169268816","1","1"
"2983be53-2cfb-474f-a6c9-00183aa78236","Samsun Kapalı Spor Salonu","Samsun","19 Mayıs Üniversitesi Profesör Mehmet Yalçın Taşmektepligil Spor Salonu, Körfez, 19 Mayıs Ünv.,","41.3718295","36.2087673","0","0"
"288c3fb0-571a-4d8c-b1f8-ab7c8937f39b","Samsun Yeni 19 Mayıs Stadyumu","Samsun","Sanayi Mahallesi Bakır Sitesi Caddesi No:1, 55300 Tekkeköy/Samsun","41.270174","36.355874","0","0"
"c8dbb6c9-8aa6-4f87-87da-99b29662b17a","Sanat Kahvesi","Isparta","Keçeci, Mehmet Eröz Sk. No:79, 32040 Isparta Merkez/Isparta","37.74785072","30.54575277","0","0"
"094f6ece-6447-4e81-8a9b-93dcd09b9947","Sanat Köşk Kemeraltı","İzmir","Fevzipaşa mahallesi, 848. Sk. No:21, 35000 Konak/İzmir","38.41642816","27.13107012","0","0"
"40feac0d-8969-40b4-bd25-b5bc3ab23da8","Sanat Merkezi","İzmir","Mimar Sinan, İzmir Fuarı 26 Ağustos Kapısı, 35220 Konak/İzmir","38.43046908","27.14659315","0","0"
"046eb59c-0f56-4941-b095-0b7cf326f97c","Sanat Performance","İstanbul","Sanat Performance, BEYOĞLU, İstanbul, Türkiye","41.034883","28.977813","14","25"
"d4d49e97-358a-41e0-b92c-693a7b98bc3b","Sanat Tiyatrosu","Ankara",".","39.8842112","32.75834169","0","0"
"23183473-cc06-4342-a98e-0f49580add7e","Sanat Tiyatrosu - Bilkent Sahne","Ankara","Üniversiteler, Bilkent Center Bilkent Center AST Bilkent Sahne, 1597. Cd. 3/86, 06430 Çankaya/Ankara","39.8842091","32.75834287","0","0"
"6b433321-a1f8-4ddc-a7aa-1a8aa333c001","Sancaktepe Recep Tayyip Erdoğan Kültür ve Kongre Merkezi","İstanbul","Sancaktepe Recep Tayyip Erdoğan Kültür ve Kongre Merkezi, SANCAKTEPE/ANADOLU, İstanbul, Türkiye","40.9942559346025","29.2299772824713","0","0"
"e15215fd-0cc2-4c9f-880c-bd2843ff4e71","Sancaktepe Sarıgazi Stadyumu","İstanbul","Emek Mah. Namık Kemal Cad. Sancaktepe/İstanbul","41.0045403","29.19916731","0","0"
"5e9210f8-728f-4b8e-853f-54d404da8f44","Santa Garden Kaleiçi","Antalya","Barbaros, Kocatepe Sk. No:9, 07112 Muratpaşa/Antalya","36.88379783","30.70811458","0","0"
"c8edd9d7-6234-44eb-a658-16f49d180caf","Santral Istanbul","İstanbul","Eski Silahtarağa Elektrik Santralı Kazım Karabekir Cad. No: 2 Eyüpsultan 34060 İstanbul Turkey","41.10736784","28.94747382","0","0"
"6aeee443-adc7-4ce2-9168-04e940a0ab93","Sapanca Kırkpınar Açıkhava Tiyatrosu","Sakarya","Sapanca Kırkpınar Açıkhava Tiyatrosu, SAPANCA, Sakarya, Türkiye","40.6949512655109","30.2106842540238","1","1"
"24ac5218-c1b9-4b60-8a01-8bb05148a9b7","Sardunya Alsancak","İzmir","Alsancak, Muzaffer İzgü Sk. No:11, 35220 Konak/İzmir","38.43828284","27.14267135","7","7"
"41821b2f-d083-496e-bc85-d14ccfbba919","Saros Körfezi - Danişment Sahili","Edirne","KEŞAN / Edirne","40.60021092","26.41197407","0","0"
"0882c41f-7718-4e7b-b959-881a78ca82f5","Sarıgerme Plajı","Muğla","Sarıgerme Plajı, ORTACA, Muğla, Türkiye","36.702088","28.694814","9","9"
"add3c5c6-ad32-4926-b620-4c096d6d0771","Saygın Kır Düğün Salonu","Bursa","Demirtaş Cumhuriyet, İnönü Cad., 16245 Osmangazi̇/Bursa","40.25616885","29.09438808","0","0"
"8276710f-5976-475a-b87e-79d272448ca1","Sazova Amfi Tiyatro","Eskişehir","Sazova, 26150 Tepebaşı/Eskişehir","39.76434886","30.47489808","0","0"
"2987aca1-f71d-4577-8b91-3c9e224cf589","Scholl of Akmerkez by Wise Akademi","İstanbul","Akmerkez AVM, Kültür Mh. Nispetiye Cd. 54/Alt Kat, 34340 Beşiktaş/İstanbul","41.07753599","29.02631146","0","0"
"bd014807-4a99-416b-9c0e-b2892fda46b0","Secret Line","Kırklareli","Karakaş mah Babaeski yolu 3. Km merkez Kırklareli","41.70763243","27.20832976","0","0"
"951b6483-07bc-4ed5-97f0-844d7a976975","Seferihisar Doğanbey Plajı Sakız Ağacı Mevkii","İzmir","Seferihisar Doğanbey Plajı Sakız Ağacı Mevkii","38.06171685","26.89576789","0","0"
"116b0ee5-95c2-4c9d-9a59-cb3857ac669c","Seferihisar Sığacık Akarca Plajı","İzmir","Sığacık, Akarca Cd., 35460 Seferihisar/İzmir","38.17334068","26.8002902","0","0"
"4e91ba02-ac54-491c-9f5a-aad95f245637","Seferihisar Çağan Irmak Salonu","İzmir","Hıdırlık Mahallesi 11 Eylül CAD. No:4/c Seferihisar İzmir","38.1954957","26.8391944","0","0"
"9041f991-d0b8-40db-a76b-a3fc4b80863e","Seifreccia Library & Coffee","Ankara","Kent Koop Mah. 1862 Cad. E2 Blok 6/14 Yenimahalle/Ankara","39.96492","32.719068","0","0"
"963a5413-a799-4768-bd4e-0222b269e5f7","Sekizde Sahne","İzmir","Doktor Faik Muhittin Adam cad. N0.13 Konak Mah. Kemeraltı Konak İzmir","38.41820159","27.13167026","0","0"
"42b91ad5-6f8a-4df7-aef3-640146834367","Selahattin Akçiçek Kültür Ve Sanat Merkezi - Avni Anıl Sahnesi","İzmir","Fatih, İnönü Cd. 2 /1, 35140 KONAK / İzmir","38.41144541","27.12820966","0","0"
"650168a7-92f4-4ef5-be09-5ce904380d21","Selahattin Akçiçek Kültür Ve Sanat Merkezi - Gülriz Sururi Sahnesi","İzmir","Avni Anıl Sahnesi, Fatih, Birleşmiş Milletler Cd. 48 B, 35260 Konak/İzmir","38.41130566","27.12818886","0","0"
"12066e88-6ef5-42cf-88c5-7ada0f2a750e","Selamiçeşme Özgürlük Parkı","İstanbul","Göztepe 34730 Kadıköy/İstanbul","40.9797616","29.0546265","2","2"
"c916de06-eba8-463c-81e0-9aa1f2a0dd96","Selfie Parkı","Antalya","Selfie Park, Fener Mah. 1964 Sok. Akanay Apt, D:No:37/A, 07100 Muratpaşa/Antalya","37.08910857","30.87588858","0","0"
"8b94371d-b603-416e-842e-e32023c7adbb","Selman-ı Pak Kültür Merkezi","Adana","Hanedan, 35027. Sk. No:11, 01060 Seyhan/Adana","36.98721625","35.31898365","0","0"
"63fbce87-0e58-46ba-af19-6d7bc79b708f","Selçuk Belediyesi Düğün Salonu","İzmir","Zafer, Bozkır Cd. No:11, 35925 Selçuk/İzmir","37.9520041","27.37330126","0","0"
"e88b445c-8e39-47b0-a5ee-a9fa7880539a","Selçuklu Belediyesi Nikah Salonu","Konya","Şeyh Şamil, 42070 Selçuklu/Konya","37.94618837","32.50246043","0","0"
"a3e1240d-5204-438e-b905-423ef6b18dfd","Selçuklu Kongre Merkezi","Konya","Horozluhan, Yeni İstanbul Cd. No: 62/1, 42110 Selçuklu/Konya","37.93613193","32.51174306","1","1"
"6b15690d-b785-4f96-9281-fc912db83243","Selçuklu Kongre Merkezi  Oditoryum","Konya","Horozluhan, Yeni İstanbul Cd., 42110 Selçuklu/Konya","37.93677535","32.51202589","0","0"
"2f1a99e7-67ec-482c-ad1e-c07b3ee7dfbd","Selçuklu Kongre Merkezi Anadolu Sahne","Konya","Selçuklu Kongre Merkezi Anadolu Sahne, SELÇUKLU, Konya, Türkiye","37.936741","32.511165","1","1"
"71014ddc-bb51-4c21-9a99-5f3ba68597c8","Selçuklu Kongre Merkezi Açıkhava Sahnesi","Konya","Selçuklu Kongre Merkezi Açıkhava Sahnesi, SELÇUKLU, Konya, Türkiye","37.937022322371","32.5112927265694","11","21"
"c08fad9a-ac5b-47f3-9c44-09ba79f3f40a","Selçuklu Kongre Merkezi Konya Sahne","Konya","Selçuklu Kongre Merkezi Konya Sahne, SELÇUKLU, Konya, Türkiye","37.936741","32.511165","1","1"
"5fc99727-b520-4439-855e-43ca053cc143","Selçuklu Kongre Merkezi Kubad Abad Balo Salonu","Konya","","0","0","1","1"
"98b4437a-63bd-44f3-9dbf-9eabed3a4579","Serdivan Belediyesi Kültür Sanat ve Kongre Merkezi","Sakarya","Arabacıalanı, Mehmet Akif Ersoy Cd. No:1, 54050 Serdivan/Sakarya","40.77263741","30.36383656","0","0"
"c863b6a4-1974-46d9-a0ac-04724ce88e06","Serdivan Kapalı Spor Salonu","Sakarya","Köprübaşı, Mehmet Akif Ersoy Cd., 54130 Serdivan/Sakarya","40.78857686","30.36826626","2","2"
"842a8088-0e56-4409-bdef-2beb0f878d22","Servet Tazegül Spor Salonu","Mersin","Afetevler, 32. Cd. No:2, 33110 Akdeniz/Mersin","36.789128087805","34.5519545653318","0","0"
"c2726a24-df18-44b5-8175-f6164c496ea3","Ses 1885 - Ortaoyuncular Tiyatrosu","İstanbul","Ses 1885 - Ortaoyuncular Tiyatrosu, TAKSİM, İstanbul, Türkiye","41.034389","28.979183","1","1"
"019a7d08-7254-40b0-88e9-2e156ab0d1dd","Ses 1885 Ortaoyuncular Tiyatrosu","İstanbul","İstiklal Caddesi Halep İşhanı 62/90, 34435 Beyoğlu/İstanbul","41.0352427","28.97916672","0","0"
"f69e2f67-d1f9-4d6f-9592-f3b458f249b3","Sestra Bistro","Çanakkale","Kemalpaşa, 17000 Çanakkale Merkez/Çanakkale","40.1491994","26.40121902","0","0"
"1d8fd260-67e5-4b4e-8bd9-cce3963192a5","Setenay Cengiz Sanat Cafe Bar","Balıkesir","Akçaali Mah. 19.Sok. No:23  Gönen/Balıkesir","40.10638003","27.65231151","0","0"
"a5b5f943-5405-4cef-8bca-a26bb2e7d2dc","Seth Gastro House","İzmir","Alsancak, 1456. Sk. No:33, 35220 Konak/İzmir","38.43920725","27.14467308","0","0"
"cb973053-2bb4-4967-a5cc-5216bf4213ea","Sevdam Düğün Salonu","Giresun","Teyyaredüzü Mh. Merkez / GİRESUN","40.89655529","38.34984801","0","0"
"f9719669-70e7-4bb3-bde2-b857a05d8f74","Seyhan Yaşar Kemal Kültür Merkezi - Mehmet Akif Ersoy Salonu","Adana","Döşeme, 01130 Seyhan/Adana","36.99113175","35.31932626","0","0"
"6877025a-097c-4763-896e-f2a4645d4e26","Seyrantepe Kapalı Spor Salonu","Diyarbakır","Cumhuriyet, 395. Sk. no:3, 21120 Yenişehir/Diyarbakır","37.93567597","40.21107397","0","0"
"69fec4df-3b61-4947-8645-3e5f29b45a80","Seyrek Plajı / Patagonya World","Kocaeli","Çalköy, 41600 Kandıra/Kocaeli","41.1346654","30.10135746","1","1"
"ed8b0e68-e886-45ac-a8de-3e10c9ca0412","Sezen Hookah & Lounge","Kırıkkale","Yenişehir Mah. Yurt-kur Caddesi 255/1\nYAHŞİHAN / Kırıkkkale","39.87242911","33.45704297","0","0"
"2a39409b-931a-40ed-af44-81175d8aa561","Shelly Bar","Mersin","Merkez, Binali Yıldırım Cd. 7/B, 33730 Erdemli/Mersin","36.60368069","34.31420804","0","0"
"a4745f35-2e56-4b01-87da-3930cee2242c","Sheraton Grand","Adana","Sinanpasa Mh. Haci Sabanci Bulvari No: 7,Adana,1220","36.99541938","35.34030183","0","0"
"17ff2e11-e508-4557-90cf-fa0763b3af0e","Sheraton Grand Beach","Samsun","Liman, Atatürk Bl. No:55, 55100 İlkadım/Samsun","41.31942751","36.33681525","0","0"
"6ddba3d5-1456-414d-8b72-40972a17e7eb","Sheraton Grand Hotel","Samsun","Liman, Atatürk Blv. No:55, 55100 İlkadım/Samsun","41.3190628","36.33754494","1","1"
"5a0aacd7-2efe-460e-ab53-0063144c86a6","Sheraton Grand Samsun Hotel","Samsun","Sheraton Grand Samsun Hotel, İLKADIM, Samsun, Türkiye","41.313773675819","36.3375362689871","1","1"
"181222f3-61f5-4833-921d-60ce1794dab6","Sheraton Istanbul City Center","İstanbul","Hacıahmet, Kurtuluş Deresi Cd. No:23, 34440 Beyoğlu/İstanbul","41.0392665","28.97455762","0","0"
"8fabd0b3-0096-4779-a4c1-f0441a5fa2fa","Showlove Coffee","İzmir","Bostanlı, Cemal Bülbül Sk. No:11/B, 35590 Karşıyaka/İzmir","38.45860841","27.09770081","0","0"
"41aebdaa-d0e6-4aec-8fdc-6e420a6a6787","Silifke Belediyesi Kültür Merkezi","Mersin","Saray, 125. Sk., 33950 Silifke/Mersin","36.37922349","33.92516919","0","0"
"1239af4a-dc83-43c0-846d-e186a83433df","Silifke Prof.Dr. Doğan Cüceloğlu Kültür Merkezi","Mersin","Yeni, 364. Sk., 33940 Silifke/Mersin","36.3662303","33.94588508","0","0"
"ee605b97-d0d8-4080-bc59-86a2f59f282e","Silinecek","İzmir","Silinecek","38.43310602","27.14979062","0","0"
"3a3f7673-6a7a-4df5-929e-245e9c32ddf1","Simurg Cafe","Antalya","Selçuk, Tabakhane Sk., 07100 Muratpaşa/Antalya","36.88635955","30.70461624","0","0"
"ab0fc64c-456f-4ed1-a857-add31251de2c","Simurg Cafe Bar - Antalya","Antalya","","36.885911","30.702429","1","1"
"18befe92-7a3b-41de-b625-9a44dc5a8eb5","Simurg Cafe Kaleiçi","Antalya","Simurg Cafe Kaleiçi , MURATPAŞA, Antalya, Türkiye","36.885916","30.704615","1","1"
"e292ecdd-1097-46f9-b64d-fcd4d003a995","Simyacı Şarlo","İstanbul","Caferağa Mah.Miralay Nazım Sk. No:20, Kadıköy/İstanbul","40.98791449","29.02779058","0","0"
"73c26668-dbb8-4808-a351-d658580c29dd","Sinan Bengier Tiyatro Salonu","Ankara","Kardelen, Başkent Blv. No:224, 06370 Yenimahalle/Ankara","39.96942737","32.71693258","0","0"
"e8652d3c-c289-4f4c-bb08-068330d93db1","Sinanpaşa İş Merkezi","İstanbul","Sinanpaşa İş Merkezi,5.Kat,Falan Ofis, Beşiktaş","41.04397474","29.00584548","0","0"
"249baf32-0b63-48b4-802e-728e127ef0dd","Sir Winston Hilltown Avm","İzmir","Sir Winston/Hiltown AVM Yalı, 6522. Sk. No:3, 35550 Karşıyaka/İzmir","38.47993622","27.07434843","0","0"
"4be32f13-a914-40b9-9088-48a58edb510a","Sir Winston Pub Balçova","İzmir","Bahçelerarası Mah. Mithatpaşa Caddesi Palmiye AVM No 34/Z 065, 35330 Balçova","38.39523117","27.05062114","0","0"
"719343e6-969b-48e7-a1a7-c42ff5a7d90b","Sir Winston Pub Myvia","İzmir","Kazım Dirik mah. Sanayi cad. No:33 Z/6 Bornova","38.45079443","27.20059639","0","0"
"ab786606-b01b-40c3-8163-7b942ed01e3d","Sir Winston Pub Sahilevleri","İzmir","Sahilevleri, Gürler Cd. No:56, 35320 Narlıdere/İzmir","38.40646271","26.99931195","0","0"
"789b6466-e2bf-484f-80f8-e67641136c01","Skopea View Roof Bar","Muğla","Skopea View Roof Bar, FETHİYE, Muğla, Türkiye","36.7606","28.939489","0","0"
"75631284-6d46-48ff-90de-3c0f73b5a0b3","Skyfall Arena","Muğla","Ölüdeniz Mah. Cumhuriyet Cad. No:25 Muğla/Fethiye","36.57242487","29.1352276","0","0"
"f02c9a5a-e4d8-4bb6-8b06-d12c9e3886d4","Sobremesa Coffee","Kocaeli","Seymen Caddesi, Sarı Leylak Sk. Ekşi İş Merkezi No 1/B, 41330 İzmit/Kocaeli","40.77569853","29.97726926","0","0"
"9cf3bc0d-6225-4446-8b6c-e1987e48dd16","Social","Eskişehir","Hoşnudiye, Vural Sk. No:33, 26130 Tepebaşı/Eskişehir","39.96081008","30.50678313","0","0"
"08dcff10-0d79-46e5-b585-79964bbcedcc","Social Casual","Eskişehir","Yenibağlar m, Fabrikalar Sk No:1/D, 26000 Tepebaşı/Eskişehir","39.91447976","30.46608093","0","0"
"29a91a31-4423-4375-a683-9327dc4ac8b2","Social Coffee","Eskişehir","Sümer, 905. sok no:15/1, 26000 Odunpazarı/Eskişehir","39.76143868","30.48593665","1","1"
"0f1dae62-8aa9-4dc5-9afb-e1e759e8f588","Social Coffee Co. (Uncubozköy)","Manisa","Uncubozköy, Cemal Ergün Cd. No:74 D:88, 45030 Yunusemre/Manisa","38.60782401","27.38695934","0","0"
"330d9177-cd41-4c2d-9ad1-c48b5f953871","Social Pub Bodrum","Muğla","Gümüşlük mh. Atatürk cd. No:6/2\nGümüşlük jandarma kavşağının 50 mt. ilerisi ana yol üstünde sağda …","37.05290782","27.24835587","0","0"
"5404b2c2-59bd-4e06-96eb-73c83c12547f","Social Stage","Ankara","Meşrutiyet, Selanik Cd No:78/B, 06420 Çankaya/Ankara","39.91673395","32.85779185","0","0"
"7d3940fe-678b-4da1-add1-bae8e84632b6","Social Street","Ankara","Meşrutiyet, Selanik Cd No:78/A, 06420 Çankaya/Ankara","39.9170633","32.8577708","0","0"
"770044f3-14e7-4302-bf92-47210e5c3a8d","Solas Coffee (Alsancak)","İzmir","1484 sokak 7/A Alsancak-İzmir","38.43834479","27.14423883","0","0"
"c8ffbb39-015e-4148-a4fa-ea8c92fcfac8","SoldOut Performance Hall","İzmir","SoldOut Performance Hall, KARŞIYAKA, İzmir, Türkiye","38.4738218","27.0726172","5","6"
"24ca15d7-2674-4e27-b9a9-d8bc0b04b4fb","Sommer Klein Çeşme","İzmir","Sommer Klein, Alaçatı, 18001 Sokak No:3/A, 35930 Çeşme/İzmir","38.23838368","26.36721036","4","4"
"eaba248c-d028-4349-945c-5ed3ae59a0fc","Sonat Sahne","Aksaray","Taşpazar, Ebulfeyz Elçibey Cd. No:47, 68100 Aksaray Merkez/Aksaray","38.36938472","34.01836104","0","0"
"9cb1fa11-8731-489c-84dc-994ab56add89","Sonat Sahne Performance","Aksaray","Bayram Baba, 3502. Sokak No:31, 68100 merkez/Aksaray","38.38816868","34.04345343","0","0"
"03c0e799-02d2-400e-912f-be738ab73c79","Sors coffee roastery","Aydın","Hasanefendi-ramazan Paşa, 2. Sk. No:44, 09100 Efeler/Aydın","37.85166757","27.84476648","0","0"
"d592e099-8786-4432-a657-19629a72f43f","Soso Bodrum","Muğla","Soso Bodrum\n, BODRUM, Muğla, Türkiye","37.0339738529423","27.4349158306877","1","1"
"fc7d3749-1493-4900-9fed-a2a2928a6cae","Sosya Pub","Ankara","Trio Yaşam Merkezi 2.kat Görükle Mah. Atatürk Caddesi No:101 Nilüfer/Bursa","39.93047677","32.82711923","0","0"
"98898a61-f09e-48a1-a25f-dfc22a39dd78","Sosyal Sanathane (Alsancak)","İzmir","Alsancak, 1458. Sk. No: 8, 35220 Konak/İzmir","38.43841872","27.14675038","0","0"
"9cb79387-4e80-41d0-a138-02bf8e7b09d4","Sosyal Sanathane (Bostanlı)","İzmir","CENGİZ KOCATOROS SOKAĞI NO:20\n35590 BOSTANLI, KARŞIYAKA, İZMİR","38.4612615","27.09912866","0","0"
"ebac43bc-8426-4759-a682-ad7ed1d23471","Sosyo Pub","Bursa","Trio Yaşam Merkezi 2.Kat Görükle Mah. Atatürk Caddesi No:101 Nilüfer/Bursa","40.22699113","28.85088183","0","0"
"b321eee1-de8d-4a7b-b47b-5acb721be39c","Sosyo Pub","İstanbul","Barboros Mahallesi Mor Zambak sokak Bulvar216 B blok No:1 Dükkan:9, 34746 Ataşehir/İstanbul","40.99406598","29.11050907","0","0"
"ec791e27-d1ed-4dcf-91f4-2f5d6ca0f00c","SosyoPub","Eskişehir","Hoşnudiye, İsmet İnönü-1 Blv No:113, 26130 Tepebaşı/Eskişehir","39.78253259","30.50618805","0","0"
"664b30b8-e284-4cfe-869e-5cf9fc1cb865","SosyoPub","Ankara","Bahçelievler, Azerbaycan Cd. No: 41, 06490 Çankaya/Ankara","39.92783118","32.82711022","0","0"
"de2bb7dd-e13d-4c04-8080-d1dd4c1d214c","Soul Pub","Eskişehir","Eskibaglar Mahallesi Fabrikalar Sokak 1/B Eskisehir","39.78252354","30.50951339","0","0"
"a6fcb527-4aba-430b-85c6-f5e027a25ec3","Soulmate Coffee&Bakery Meram","Konya","Orgeneral Tural, Şehir Cd. no:15A, 42140 Meram/Konya","37.86482289","32.46230356","0","0"
"f27d5b50-f7e8-40eb-b1e1-c2e41fb76220","Soweto Modern Birahane (Alsancak)","İzmir","Alsancak, Cumhuriyet Blv No:240, 35220 Konak/İzmir","38.43812932","27.142075","0","0"
"a5605b83-15ab-4f09-8f08-23880f1afcca","Space Akyaka","Muğla","Space Akyaka, ULA, Muğla, Türkiye","37.054019","28.341147","0","0"
"62739ff2-5f93-43ab-8e9d-1fa946113d26","Sponge Pub Kaleiçi","Antalya","Sponge Pub Kaleiçi, MURATPAŞA, Antalya, Türkiye","36.8854361","30.7025673","4","5"
"76223fde-d676-454a-aab2-06d03655f7aa","Sponge Pub Konyaaltı","Antalya","Sponge Pub Konyaaltı, KONYAALTI, Antalya, Türkiye","36.8653951470897","30.6431959979526","6","6"
"15ce916c-3573-44b5-87cb-a7589e9ebc6b","Sponge Pub Lara","Antalya","Şirinyalı, Eski, Lara Cd. No: 137, 07022 Muratpaşa/Antalya","36.85810671","30.73876216","0","0"
"e00835f2-5823-4b13-b84e-480e8bf01fb4","Spor Kompleksi","Kahramanmaraş","Hacımustafa, Onikişubat/Kahramanmaraş","37.55328523","36.91725333","0","0"
"1a822cab-3ad2-4e73-ac43-b7ce710a4ba4","Stade du Hainaut","Nord-Pas-de-Calais","","50.3481","3.53306","1","1"
"fd101805-2d47-4ea9-97dc-9216093031bc","Stage On The Beach","İzmir","Stage On The Beach, ÇEŞME, İzmir, Türkiye","38.357546","26.304371","0","0"
"5d588f79-26eb-411d-97e8-1cc14a11f4e3","Stifno Alaçatı","İzmir","Alaçatı Mh. 12038 sk. No: 37 Çeşme/İzmir","38.3260884","26.35926922","0","0"
"d9380df2-bb21-4312-b088-1ef72cf98f7b","Studio House (Alsancak)","İzmir","Alsancak, Muzaffer İzgü Sk. No:9, 35220 Konak/İzmir","38.43846272","27.14269308","0","0"
"6788337d-37b6-4fe6-9369-3fa37f30d369","Studio House (Bornova - )","İzmir","Kazımdirik, MyVia 414 Park AVM, Sanayi Cd. No. 31, 35100 Bornova/İzmir, Türkiye","38.4510119","27.20310494","0","0"
"343cda39-17ab-4b40-baac-1c62fd29db07","Studio House (Karşıyaka - Atakent)","İzmir","Atakent, 2035. Sk. No. 4, 35590 Karşıyaka/İzmir","38.46736803","27.08671444","0","0"
"fb113163-a940-4600-930c-e1f724060da5","Studio No:24","Ankara","Mutlukent, 2073. Sk. No:7, 06810 Çankaya/Ankara","39.89888741","32.70743112","0","0"
"bc57ef9b-9c13-4465-9d13-4e609d32dabd","Suadiye Sahne","İstanbul","Suadiye, Emin Ali Paşa Cd. No:35/1, 34740 Kadıköy/İstanbul","40.96168962","29.08814449","0","0"
"04c42312-dc57-4e3c-ac2b-ecf9515bad4c","Suare","Bursa","Fethiye, Emek Cad. No:19, 16140 Nilüfer/Bursa","40.31110444","28.95265702","0","0"
"5b72f858-ec22-434b-9205-d08638ac71e4","Suda Tur Teknesi","İstanbul","","0","0","1","1"
"4ea353f8-d670-43ba-a9dd-cbe133a06de2","Sufle Sanat Tiyatrosu","Antalya","Sufle Sanat Tiyatrosu","36.87020609","30.72480588","0","0"
"a7aad8e9-7601-44ee-b33e-e71d097a1fbd","Sunsan Hotel","Çanakkale","Dardanos, Sunsan Hotel & Restaurant, Dardanos Cd. No:31, 17100 Çınarlı/Çanakkale Merkez/Çanakkale","40.08121421","26.36525177","0","0"
"c69563e5-e532-4373-a8fd-2c96ad14d77b","Sunset Private","Antalya","Fener Caddesi Erdoğan İş Merkezi No:12 Muratpaşa, Antalya, Turkey, 07230","36.85111688","30.76184947","0","0"
"38abcf71-f3e2-4832-8e93-2583ffa48776","Suo-Lo Life & More (Urla)","İzmir","Yeni Mahalle, Postane Sk. No:9, 35430 Urla/İzmir","38.32215707","26.766104","0","0"
"f2d57dad-d4a2-4efa-bad5-9eecc3d7bf9e","Sur Bar Erdek","Balıkesir","Zeytinli, 10500 Erdek/Balıkesir","40.38857432","27.79596138","0","0"
"471b2747-a362-41ba-b815-c149a7c0c99e","Sural Çiftliği","Balıkesir","Altınova Mah. Yukarı Karayer Küme Evleri No:9 Ayvalık/ Balıkesir","39.24477773","26.76261505","1","1"
"5945fd20-ab5b-4de9-aa00-1cf1331dc4d9","Suretler Tiyatro","Sakarya","Kemalpaşa, Medeniyet Bulvari, 54100 Serdivan/Sakarya","40.76374062","30.35946135","0","0"
"350aff85-dfd7-4bfa-b21b-93f6add36e88","Susona Bodrum, LXR Hotels & Resorts","Muğla","Susona Bodrum, LXR Hotels & Resorts, BODRUM, Muğla, Türkiye","0","0","2","2"
"4fa4b43d-bb92-4c91-a8ef-279586ac59b7","Susurluk Kongre ve Kültür Merkezi","Balıkesir","Yeni, Susurluk Belediye Parkı, 10600 Susurluk/Balıkesir","39.91939064","28.15521508","0","0"
"576a1167-23c0-4821-b066-5d33cb5d3c9b","Sveyka Marin","Mersin","Eğriçam, Adnan Menderes Blv. No:33, 33160 Yenişehir/Mersin","36.77074823","34.56758987","0","0"
"f3253cb3-85e5-4fb7-93f5-fd3996d459d7","Swissotel Büyük Efes","İzmir","Swissotel Büyük Efes İzmir, ALSANCAK, İzmir, Türkiye","38.428661","27.135679","0","0"
"3531ea2c-28b6-42ad-b1c5-719f41334b09","Swissotel Büyük Efes, Izmir","İzmir","Alsancak, Gazi Osman Paşa Blv. No:1, 35210 Konak/İzmir","38.42802093","27.13576207","0","0"
"19824763-abe7-4c05-825a-bb33ba26dbeb","Swissotel The Bosphorus","İstanbul","Swissotel The Bosphorus, BEŞİKTAŞ, İstanbul, Türkiye","41.041866","28.998155","28","32"
"9c6cb30e-4dd9-415f-8d86-4822a9823587","Swissotel The Bosphorus, Istanbul","İstanbul","Vişnezade Mahallesi Acısu Sokak No: 19 Beşiktaş / İstanbul","41.04116171","28.99767992","0","0"
"aba44eec-74d4-4672-b48c-bdf9bac160c0","Swissôtel The Bosphorus","İstanbul","Vişnezade Mah. Acısu Sk. No.19 Maçka/İstanbul","41.041276","28.997513","1","1"
"19e3ec93-acdd-4ad9-bb22-700a03b3387e","Söke Amerikan Kültür Koleji Konferans Salonu","Aydın","Yenikent M. İsmet İnönü C.Kuşadası Yolu solu 7/3A Söke/AYDIN","37.76084262","27.38043495","0","0"
"1ac4b69a-f1b9-43ab-962d-978391fb28a8","Söke Recep Yazıcıoğlu Kültür Merkezi","Aydın","Konak, Namık Kemal Cd., 09200 Söke/Aydın","37.75628062","27.40732802","0","0"
"8a956021-1ea5-4825-9503-47653506df8b","Söğütlü Bahçe","Ankara","Aşağı Yahyalar, Mehmet Akif Ersoy Cd. No:6/1, 06374 Yenimahalle/Ankara","40.14669529","32.7823355","0","0"
"ab3cd0eb-b45f-4aff-a10f-0c0aa3e6a250","Süleyman Demirel Kongre Merkezi","Isparta","Bahçelievler, 3013. Sk. No:23, 32200 Isparta Merkez/Isparta","37.96757461","30.48334751","0","0"
"8147b976-9851-4a94-bdc4-32161ffd6a8d","Süleyman Demirel Kültür Merkezi Büyük Salon","Kocaeli","Yahyakaptan, Akasyalar Cd., 41050 Merkez/İzmit/Kocaeli","40.87699422","29.97858433","0","0"
"8711662f-5141-4e29-a805-07a51e41df76","Süleyman Demirel Kültür Merkezi Oda Tiyatrosu","Kocaeli","Yahyakaptan, Akasyalar Cd., 41050 Merkez/İzmit/Kocaeli","40.87699422","29.97858433","0","0"
