"id","name","city","address","latitude","longitude","future_event_count","future_session_count"
"2df0381d-653a-4386-89f2-fee03370262e","Kongre Merkezi Harbiye Oditoryumu","İstanbul","Harbiye, Darülbedai Caddesi No:3, 34367 Şişli\nHARBİYE / İstanbul","41.04636355","28.98893566","0","0"
"d0861bcd-51eb-44df-8bf4-a214ebde1611","Kontrbus Coffee","Aydın","Hasan Efendi Mahallesi, Kazım Karabekir Cd. No:24, 09100 Efeler/Aydın","37.85028131","27.84342883","0","0"
"2e606eee-9fa9-4b89-aec2-63f9f0ba4aff","Konyaaltı Belediyesi Nazım Hikmet Fuar ve Kongre Merkezi","Antalya","Pınarbaşı Mahallesi, 734. Sk. No:36, 07070 KONYAALTI / Antalya","36.88479487","30.65056514","1","1"
"48a08359-5bf8-4c31-b893-6712848ae70a","Konyaaltı Belediyesi Nazım Hikmet Kongre ve Fuar Merkezi - Antalya","Antalya","Konyaaltı Belediyesi Nazım Hikmet Kongre ve Fuar Merkezi - Antalya, KONYAALTI, Antalya, Türkiye","36.884929","30.650544","6","6"
"319de358-2342-41b0-a804-4629dda4eec1","Kordon Otel Çankaya","İzmir","Çankaya, Gazi Osman Paşa Blv. No 13, 35240 Konak/İzmir","38.42516806","27.13794073","0","0"
"657ac813-c57d-4146-8f80-10af5c4d0e50","Korupark AVM Bowling Salonu","Bursa","Emek Adnan Menderes, Korupark 9 Km, 16160 Osmangazi/Bursa","40.2513308","28.95934334","0","0"
"b38d76af-7ab9-464b-9e42-25786450f882","Kozlu Belediye Plajı","Zonguldak","Milli Egemenlik Cd. No:151, 67600 Kozlu;","41.48735729","31.70831249","0","0"
"f355cffd-e313-47ef-aab0-d3a13fb09c1b","Kozlu Garden Park","Zonguldak","Merkez, 67602 Kozlu/Zonguldak","41.44031757","31.73463681","0","0"
"2fcec4dd-83ab-4767-8fa2-53b7fc7083cf","Kozyatağı Kültür Merkezi","İstanbul","Kozyatağı, Buket Sk. No:1, 34000 Kadıköy/İstanbul","40.97049529","29.09216311","0","0"
"17cc0f03-e009-4fd9-b827-8083901e49c8","Kozzy Kahve Dünyası","İstanbul","Kozzy Kahve Dünyası , KADIKÖY, İstanbul, Türkiye","40.970226","29.091912","2","4"
"e568e22e-3d46-49cb-b577-46b54d8eada1","Kraft Ayvalık","Balıkesir","İsmetpaşa, Balıkhane Sokak No: 15, 10400 Ayvalık/Balıkesir","39.32051293","26.69226638","0","0"
"c36cfdea-861b-40d5-80a4-560a5bb4aac9","Kristall Club Kemer","Antalya","Merkez, Deniz Cd. No5, 07980 Kemer/Antalya","36.60480836","30.56484041","0","0"
"85019351-e508-401d-8f18-84d7495e2be4","Kulem Park Sosyal Tesisleri","Erzincan","Atatürk, Zübeyde Hanım Cd. No:6, 24180 Erzincan Merkez/Erzincan","39.75040785","39.49211384","0","0"
"858609c1-458b-456e-aadb-8ca277be24a9","Kullanılmıyor - Cevahir AVM Sahne","İstanbul","Merkez, Büyükdere Cd. 41, 34381 Şişli/İstanbul","41.06328642","28.99101944","0","0"
"11b82f01-5a21-4a11-bab3-0efd7d77a61c","Kullanım Dışı","İstanbul","Kullanım Dışı","40.99703019","29.09994649","0","0"
"22286519-6ac6-496a-820a-026e3e544776","Kulüp","Antalya","Meltem, Beach Park No:18, 07030 Muratpaşa/Antalya","36.88164857","30.66674796","0","0"
"7ebba4fd-1331-4857-9f94-44facef8e40e","Kulüp","Edirne","Sabuni mahallesi Saraçlar caddesi fuzili sokak No2/1 Altunhan hotel altı EDİRNE","41.67337906","26.55360676","0","0"
"645f9f98-7485-4d17-afce-7c5ed2ee199f","Kulüp Müjgan","Ankara","Kulüp Müjgan, ÇANKAYA, Ankara, Türkiye","39.909769327381","32.8585571979285","2","2"
"3d12f484-96b0-4721-876b-be4919fe5762","Kum Heykel Müzesi","Antalya","Kum Heykel Müzesi, MURATPAŞA, Antalya, Türkiye","36.8487736777829","30.8142805387339","1","26"
"3fe8dba8-cfe6-4f2b-b37a-dc3c8a9ece15","Kumbara Kültür Sanat Akademi","Van","Alipaşa, İller Bankası Sk. No:5, 65130 İpekyolu/Van","38.5016088","43.37653023","0","0"
"10873d19-0660-499c-953c-13caee40f0ae","Kuppa Club","İstanbul","Namık Kemal Mahallesi Tonguç Baba Caddesi, Haramidere Yolu No:84, 34513 Esenyurt/İstanbul","41.00869249","28.68947329","0","0"
"ed7d4c58-e4c1-4db7-8c35-c411f7bdb06e","Kups Mekan","İstanbul","Vadistanbul, Azerbaycan Cd. No:3 İç Kapı No:168, 34396 Sarıyer/İstanbul","41.10884","28.98652","1","1"
"40681b19-0616-4c68-a45a-e26b36cce59d","Kups Mekan","İzmir","Dumlupınar, 109. Sk. No:14, 35390 Buca/İzmir","38.38538747","27.17111605","0","0"
"184154de-d88c-49b7-80e0-8d1fa78656df","Kups Mekan | Vadİstanbul","İstanbul","Kups Mekan | Vadİstanbul, SARIYER, İstanbul, Türkiye","0","0","3","4"
"c2df0611-5168-48d5-8b31-f987faa2b399","Kuytu Cafe&Bar","Antalya","Kalkan mahallesi defne yalı boyu Sokak no1  kaş antalya","36.26495411","29.40696469","0","0"
"62a8485b-e0b0-4963-bdac-f8badd063a42","Kuzeykent Kapalı Pazar Yeri","Kastamonu","Kuzeykent, Kuzeykent İş Mrk. İç Yolu 22 BU, 37150 Kastamonu Merkez/Kastamonu","41.42836762","33.77866905","0","0"
"cecb1a4b-9860-4cb3-a691-1fb1aaa6426f","Kuşadası Altın Güvercin Amfi Tiyatro (Kuşadası AVM)","Aydın","Kuşadası-Söke Yolu, 6. kilometre Kuşadası / AYDIN","37.8096319","27.2776536","2","2"
"f11543fc-f536-4bc8-88ef-cf9440b072f8","Kuşadası Jade Beach Club","Aydın","Kadınlar Denizi, Yılancı burnu Mevkii, 09400 Kuşadası/Aydın","37.85882277","27.24519893","0","0"
"b4332d68-2829-4472-ad1c-f0ba0fbf4caa","Kült Kavaklıdere","Ankara","Barbaros, Tunalı Hilmi Cd. No:105 D:A, 06700\nÇANKAYA / Ankara","39.90493085","32.86084844","0","0"
"f2a434de-748f-4577-9afc-97c71991df24","Kültür Mantarı Cafe & Bistro","İzmir","Gazi Mustafa Kemal Mahallesi Kaynaklar Caddesi no:64/A Seyrek MENEMEN / İzmir","38.58301243","26.96482162","0","0"
"6f1bb446-f601-421f-b7a3-0093a849aac5","Kültür Merkezi","Muş","Saray, 49200 Muş Merkez/Muş","38.74355098","41.52661853","0","0"
"cdbb45c2-1e73-4ca6-bc61-a4c0f0b6e2b7","Kültür Merkezi","Batman","Belde, Barış Blv. No: 129, 72070 Batman Merkez/Batman","37.8993388","41.1412941","0","0"
"ac78a09d-ea98-46e7-ba3f-4f390a2ff755","Kültür Merkezi","Bartın","Tuna, Kanlı Irmak Cd. NO:282, 74100 Bartın Merkez/Bartın","41.63092366","32.34908351","0","0"
"bdb5c15d-a1da-46f1-853f-84961eab58d6","Kültür Merkezi","Sinop","Gelincik, Fatih Cd. No:24, 57000 Sinop Merkez/Sinop","42.02471397","35.136742","0","0"
"ec38219f-fae1-4bf4-85ad-405a2bfa8820","Kültür Merkezi","Burdur","Özgür, Güzelleştirme Cd. No:3, 15200 Burdur Merkez/Burdur","37.72640834","30.28860026","3","4"
"6ac968f3-8a2e-4343-b00d-f999200ce043","Kültür Merkezi","Mersin","Kültür, Atatürk Cd. No : 40, 33010 Camili Köyü/Akdeniz/Mersin","37.05666298","34.63430632","0","0"
"0d21bce3-3830-4538-aeca-eade8046699e","Kültür Merkezi","Iğdır","Söğütlü Şamil Cad. 7600 MERKEZ / Iğdır","39.92469666","44.0501349","0","0"
"64cfa70e-536a-448c-80f9-3c8696fd21c1","Kültür Merkezi","Kars","Ortakapı, Gazi Ahmet Muhtar Paşa Cd., 36000\nMERKEZ / Kars","40.60103636","43.09544846","0","0"
"4c43b2e0-3b84-4c24-83a6-c1ee69d23fee","Kültür Merkezi","Kırklareli","Karacaibrahim, Şahinler Sk. No:9, 39000 MERKEZ / Kırklareli","41.73443317","27.22520714","0","0"
"4da1299a-3df0-454a-9e0d-c0b728c5f703","Kültür Merkezi - Tiyatro Salonu","Aydın","Hasanefendi Mah. Ramazan Paşa, 1913. Sk. No:67, 09100 Efeler/Aydın","37.87351612","27.83001346","0","0"
"ed8317e5-e757-49c2-ba22-4feb5d61062e","Kültür Merkezi Celil Yağız Sahnesi","Düzce","Fevzi Çakmak, Eski Bolu Cd. No:241, 81020 Düzce Merkez/Düzce","40.98905246","31.17334111","0","0"
"bd1f449b-7248-4060-9796-4025ef1b40be","Kültür Merkezi Hidayet Sayın Sahnesi","Aydın","Hasanefendi-ramazan Paşa, 1913. Sk. No:67, 09100 Aydın Merkez/Aydın","37.85156721","27.83774717","0","0"
"93d284d0-e98e-4b61-be5b-f78eadf6c7ad","Kültür Merkezi Konferans Salonu - Küçük Salon","Aydın","Hasanefendi Ramazan Paşa Mah. 1913. Sok. 67 Efeler MERKEZ / Aydın","37.85078448","27.83784614","0","0"
"a6b4b5db-745b-4438-ba67-fe0f67c144aa","Kültür Merkezi Sahnesi","Ankara","Yaşamkent, Ankara kültür merkezi, 3054. Sk. 24/A, Çankaya","39.86896724","32.66382251","0","0"
"757a9213-748a-4e60-a236-bf67ef140dd4","Kültür Sanat Merkezi","Ordu","Akyazı Mah. Org. İbrahim Fırtına Caddesi No: 36 52200\nMERKEZ / Ordu","41.29947103","37.89879514","0","0"
"3334cb10-5d58-4139-bb13-8b50fa335cf9","Kültür ve Kongre Merkezi","Ağrı","Abide, 620. Sk. No:3, 04100 Ağrı Merkez/Ağrı","39.72062675","43.04260871","0","0"
"6c717c0e-d336-4416-9670-c1c1086b1bdb","Kültür ve Sanat Sarayı Şehir Tiyatroları Sahnesi","Eskişehir","Mamure, İsmail Gaspıralı Cd. No:1, 26120 Tepebaşı/Eskişehir","39.78157719","30.52712678","0","0"
"d8857bfa-6a81-40a2-ba75-3908a10b392b","Kültüral Performing Arts","İstanbul","Sanayi, Yeşilce Mah. Donatım Sok. 5/A 4. LEVENT, 34418 Kâğıthane","41.09672652","29.00120768","0","0"
"4450cddb-9d84-4772-9f4e-2616c407940b","Kürkçü Dükkanı Alaçatı","İzmir","Kürkçü Dükkanı Alaçatı, ÇEŞME, İzmir, Türkiye","38.2737261430672","38.2737261430672","0","0"
"e5780f80-b5e0-4529-bd75-b4ac0b5b461c","Kütahya Ressam Ahmet Yakupoğlu Konferans Salonu","İstanbul","30 Ağustos, Meriç Sk. No:4, 43100, 43100 Kütahya Merkez/Kütahya","39.4128473","29.9527616","0","0"
"55adaf41-578e-42de-91aa-7b5ea1d68208","Küçük Akyaka","Muğla","Akyaka, İnişdibi Cd. No :73, 48650 Ula/Muğla","37.05370618","28.3430596","0","0"
"f20ea1e8-2501-4889-a762-c0c305baf535","Küçükpark Bornova","İzmir","Kazımdirik, 35100 Bornova/İzmir","38.45994762","27.21373001","0","0"
"2a67050e-9112-4d4f-9166-02dff2aac9bb","KüçükÇiftlik Bahçe","İstanbul","Harbiye Kadırgalar Cad. No:4 Şişli / İstanbul","41.04361235","28.99297","0","0"
"75756abd-4b39-473f-97ab-d675e82c28ba","KüçükÇiftlik Park","İstanbul","KüçükÇiftlik Park, ŞİŞLİ, İstanbul, Türkiye","41.041936","28.994569","34","34"
"66ad81a7-0fb0-43eb-8f28-1bb608670804","Kıbrıs Girne 20 Temmuz Stadyumu","Kuzey Kıbrıs","88M4+JVM, Raif Denktaş Cd, Girne 99300","35.28631436","33.24473888","0","0"
"51732fae-c61d-49dd-a8ca-17833868c1dd","Kıbrıs Mağusa","Kuzey Kıbrıs","","35.12876387","33.94557559","1","1"
"b3378e4b-8916-4f85-97c3-01cb5b09dcee","Kılçık Mekan","İstanbul","Osmanağa, Karadut Sk. No:14/1, 34714 Kadıköy/İstanbul","40.99084085","29.03061019","0","0"
"b1be01e3-cffd-4c1b-a972-c6d658dfa9b9","Kınık Öğretmenevi Tiyatro Salonu","İzmir","Türkcedit, Kocabahçe Sk. No:5/1 Kınık/İzmir","39.08794564","27.38329074","0","0"
"3466c7d4-292c-4669-8f4b-e5dd86cf70ff","Kırkağaç Belediye Kültür Merkezi","Manisa","Kocamehmetağa, Kırkağaç/Manisa","39.10747866","27.67186023","0","0"
"e5e01f44-9165-47f6-adc0-5f01e64d8c40","Kırkpınar Açıkhava Tiyatrosu","Sakarya","Kırkpınar Açık Hava Tiyatrosu, Soğuksu, Mimar Sinan Cd. No:31, 54600 Sapanca/Sakarya","40.69417949","30.21191795","3","3"
"d92a6377-5742-420b-9ec2-1078275c7e05","Kırmızı Pub Mavişehir","İzmir","YALI. 6436 SOK. NO:120/A KARŞIYAKA MAVİŞEHİR/ İZMİR","38.47353526","27.08383079","0","0"
"213be89a-49ae-465f-ac80-8e2271d2a7cf","Kızıl Avlu","İzmir","Kızılavlu Cd. No:26, 35700","39.121867","27.182401","1","1"
"42742af9-3956-42b1-a44b-434dc9f9b930","Kızılay Nazım Hikmet Kültür Merkezi","Ankara","Kızılay Nazım Hikmet Kültür Merkezi, ÇANKAYA, Ankara, Türkiye","39.915796","32.857129","0","0"
"e6aee6f2-f102-4cc8-b800-37612d895d6c","Kızılırmak Sineması","Ankara","Meşrutiyet, Kızılırmak Cd. No:21 D:B, 06420 Çankaya/Ankara","39.91575639","32.85806858","0","0"
"65309a14-695e-4644-9653-8a13ed5e79b9","L'Agora Old Town Hotel","İzmir","Güzelyurt Mahallesi Havra Sokak No:302/1 KEMERALTI, 35210 Konak/İzmir","38.41990115","27.13541738","0","0"
"9fc9babb-935a-4059-8722-6c487aa23c3d","L'alibi Meşelipark","Bursa","Meşeli Park Tesisleri, Işıktepe Mah. Ormanlar Caddesi, Organize Sanayi Bölgesi No:1/1, 16140 Işıktepe Osb/Nilüfer/Bursa","40.22586","28.95171","1","1"
"df36e530-0c05-4cea-a614-995db22f3042","L'arena Beach","Antalya","Güzeloba Mh Lara Cad. no : 236 07230, 07252 Muratpaşa/Antalya","36.84998535","30.83881956","1","1"
"cd9b2798-37a5-4ad4-a930-838697364eb2","L'avare Alice","Ankara","Çayyolu, Ahmet Taner Kışlalı Mahallesi, 2870. Sk. 4/1, 06810 Çankaya/Ankara","39.8710023","32.68220167","1","1"
"c9450dbe-a340-41a2-9a44-6ab01429eb21","LEGOLAND® Discovery Centre İstanbul","İstanbul","LEGOLAND® Discovery Centre İstanbul, BAYRAMPAŞA, İstanbul, Türkiye","41.045497","28.895985","2","2"
"c25ad5f0-9e5d-432b-805e-f1db74a24218","LKA Longhorn","Stuttgart","LKA Longhorn Stuttgart Heiligenwiesen 6 70327 Stuttgart/Deutschland","48.76721513","9.25165061","0","0"
"1a5fd9c1-9a29-4af8-a4ca-9ac0c794cc21","LOV Faralya","Muğla","LOV Faralya, FETHİYE, Muğla, Türkiye","36.477767","29.108708","0","0"
"7c523f70-44a8-4744-bddf-25934f086d3c","LUCKY’S CLUB","Aydın","LUCKY’S CLUB, KUŞADASI, Aydın, Türkiye","37.927621","27.241465","1","1"
"82e11a32-2cf0-401e-abad-1f6acb3f160f","La Fallez Kitchen & Bar","Antalya","La Fallez Kitchen & Bar, Meltem, Tarık Akıltopu Cd. No:1/3, 07030 Muratpaşa/Antalya","36.89034466","30.67112339","0","0"
"4b32b69b-87ca-48f8-b189-1b6b0da148e0","La Puerta Experience (Mavişehir)","İzmir","Mavişehir, Caher Dudayev Blv No: 30/K, 35590 Karşıyaka/İzmir","38.48033969","27.07202008","0","0"
"f8b492dc-54c5-494b-8d1f-6480cec4b2b3","Lago Bodrum","Muğla","Akdeniz Caddesi - Göltürkbükü Mahallesi. 30. Sokak. No: 5 Bodrum - Muğla","37.11957628","27.39226649","0","0"
"0bf04927-9d85-4b06-8509-1e14cb3f7b13","Laloba Coffee & Book","İzmir","Adatepe , 4/1 sk. No:4 Buca İzmir","38.38308415","27.18272707","0","0"
"09b844e5-e402-4d3a-b8fe-16c7c5d9d69c","Latife Books & Coffee","Aydın","Mimar Sinan, Mimar Sinan Blv. No:4A, 09100 Efeler/Aydın","37.84886954","27.81122274","0","0"
"fd0a9ce6-15c2-4a05-8a19-8587cc425668","Latife Türk Kahvesi","Aydın","Mimar Sinan, Ali İhsan Paşa Blv. 13/B no:59, 09100 Efeler/Aydın","37.88538864","27.81454818","0","0"
"3b5b115d-d81f-4aae-a678-8448fed6354c","Lazlo Beach Lara","Antalya","Güzeloba, Lara Cd. No:518, 07230 Muratpaşa/Antalya","36.85285449","30.84627758","0","0"
"fd759e3a-baa3-4ef4-b833-b219b713310b","Le Miel Coffee Shop","Manisa","1. Anafartalar, Avni Gemicioğlu Cd. No:21/D, 45030 Şehzadeler/Manisa","38.61844908","27.43111514","0","0"
"10de7e94-dffc-4d58-9f41-307af6ed264d","Leb-i Derya Çorlu","Tekirdağ","Leb-i Derya Çorlu, ÇORLU, Tekirdağ, Türkiye","41.1255693406125","27.8882530701432","1","1"
"873d1e07-3d9b-444a-b534-2df96032e295","Lebowski","Gaziantep","Bey, M, Mehmet Tevfik Uygunlar Sk. No: 9, 27300 Şahinbey/Gaziantep","37.06286437","37.37873952","0","0"
"4803f88e-c829-47a7-b375-d4fdcac9ff20","Lefkoşa Türk Maarif Koleji Konferans Salonu","Kuzey Kıbrıs","Okullar Yolu Sk, Lefkoşa 99010","35.19426344","33.36677956","0","0"
"43696c15-8013-4b92-803a-bb9e50cc4ec6","Leman Kültür","Ordu","Akyazı, Merkez, 823. Sk. No:2, 52200 Altınordu/Ordu","40.98387695","37.91213916","0","0"
"93a4bcfe-c263-4581-964f-d71f8bf66205","Leman Kültür","Edirne","Leman Kültür Edirne - 1. Murat, Zübeyde Hanım Cd. 1. Sokak no3, 22030 Edirne Merkez/Edirne","41.68441378","26.52225016","0","0"
"853642c8-1de5-4903-b224-92f1de6c32ca","Leman Kültür Beyoğlu","İstanbul","Şehit Muhtar, İstiklal Caddesi. İmam Adnan Sokak. No:14, 34435 Beyoğlu/İstanbul","41.03651396","28.98124064","0","0"
"2c2002de-3d2d-46b5-9ed3-59bd17dc5a3e","Leo Bitez","Muğla","Bitez Mahallesi. Bergamut caddesi. No:40 Bodrum/Muğla","37.03024354","27.3788957","0","0"
"c43d59c7-9673-4e93-ab4a-f8e1519ff985","Leonart Atölye","İzmir","Akın Simav mahallesi mithatpaşa caddesi no 339 b İzmir konak","38.40910676","27.11345866","0","0"
"6052b2a8-417c-4324-8dab-4401aecb5bc9","Les Arena","Kuzey Kıbrıs","Aşağı Girne Mahallesi, Evliye Çelebi Sokak, Kaşgar Sahili, Les Ambassadeurs Hotel Plajı","35.3426207","33.30558664","0","0"
"6960dfd4-2da3-4bd2-a5f5-d3a29fb122a7","Leyla Dizdar Kültür Merkezi","Karabük","Bağlarbaşı, 78600 Safranbolu/Karabük","41.43746041","32.64573481","0","0"
"41ed0fc8-a4e1-43dc-8956-4a0e173b3ceb","Life Park","İstanbul","Life Park, SARIYER, İstanbul, Türkiye","41.167558","29.000749","10","11"
"f0ced9a1-c087-4d56-99f4-61fbd71e5629","Lighthouse Pool&Pub","İzmir","Yatçı kafe ve havuzu, Sığacık Mahallesi Akkum caddesi, Teos marina, D:no:4/21, 35460 Seferihisar/İzmir","38.19284541","26.78093555","0","0"
"12cf83a8-a395-4b9f-920e-a0ee2df1c6b0","Lilium Bakehouse","Sakarya","Bahçelievler, 708. Sokak no:2B, 54050 Serdivan/Sakarya","40.75899047","30.36726839","0","0"
"3dc5bb26-d397-40b3-a46e-93d2188fabdb","Lineup Suadiye","İstanbul","Suadiye, Yazmacı Tahir Sk. No:22, 34000 Kadıköy/İstanbul","40.95522246","29.08939716","0","0"
"51cfdb7f-ae1a-449a-9978-1a633ebabe6b","Lion Club Karasu","Sakarya","Aziziye, Ankara Cd. no 234/1, 54500 Karasu/Sakarya","41.08766119","30.74332394","0","0"
"f6663822-f2f1-464f-a476-456135f9856e","Lipp Mistral","İzmir","Çınarlı, Ankara Cd. No:15 Kat: 20 Ofis: 202, 35170 Konak/İzmir","38.4486148","27.1785121","0","0"
"66a8e63d-94b0-45ef-91e6-5cd9cd809b77","Lisesi Tiyatro Salonu","Balıkesir","Dumlupınar, Örnek Sk. No:15, 10010 Merkez/Balıkesir","39.64579838","27.87684051","0","0"
"0745cdd9-3c08-4fe3-9ecb-48dfda80444a","Litai Otel & Spa - Havuz Başı","Ankara","Balgat, İlhami Soysal Sk. No:3, 06520 Çankaya/Ankara","39.89935763","32.81957308","0","0"
"6d032387-e135-4423-8326-256568b6825c","Litt Kuruçeşme","İstanbul","Kuruçeşme, Muallim Naci Cd. No:71, 34100 Beşiktaş/İstanbul","41.05198044","29.03310374","0","0"
"9279a76c-7e5e-4a30-a17e-869ea819f85e","Liva Düğün","Kahramanmaraş","Liva Düğün Salonu Kahramanmaraş, Haydarbey Mahallesi Tekerek Yolu Üzeri Yeşil Vadi Sitesi Yanı","37.59171162","36.86034577","0","0"
"a66587cc-aec2-4199-a2aa-4f6997036a39","Loba Coffee & Bakery","Eskişehir","Yenibağlar, Eti Cd. No: 15/A, 26170 Tepebaşı/Eskişehir","39.9731027","30.52511263","0","0"
"1b13a67e-3d0b-499e-9aab-e0c17750bf47","Loba Coffee & Bakery","Mersin","Çiftlikköy Mah. Mimar Sinan Cad. Ekinci Akademi Concept No:13.D, 33330 Yenişehir/Mersin","36.79242935","34.53764287","0","0"
"3f0a321f-32f9-4446-b78e-ba32c0bc766d","Loba Coffee & Bakery  Adalar","Eskişehir","İstiklal, Porsuk Blv No: 43/a, 26010 Odunpazarı/Eskişehir","39.77743009","30.51387119","0","0"
"265b570c-f977-4aae-8861-e7388b904219","Loba Terrace Türkmenbaşı","Adana","Pınar, Ali Bozdoğanoğlu Blv No:50/A, 01160 Seyhan/Adana","37.02366","35.27928","1","1"
"62921620-7151-4915-908a-b774b1b9e804","Lodos Bar","Çanakkale","Cevat Paşa, Nara Yolu Sk No:1, 17010 Çanakkale Merkez/Çanakkale","40.15688808","26.40937944","0","0"
"0d8c9483-b9fb-4bc4-98d9-eb55f8f0886d","Longosphere Glamping","Kırklareli","Longosphere Glamping, Yeni Mh, Sislioba Yolu No:8, 39650 İğneada/Demirköy/Kırklareli","41.88084588","27.97540606","0","0"
"aae9da85-47e8-40d0-87b7-397f510d588b","Loni Patisserie","İzmir","Yelki mahallesi Atatürk caddesi 27/B Güzelbahçe/ İzmir","38.34326548","26.86879281","0","0"
"287989d7-470f-46bb-8b8c-9444bb40906e","Loof Beach","Kuzey Kıbrıs","Gazimağusa 99450","35.16049328","33.91345907","0","0"
"8efede29-487f-48f8-9436-99c4c868e674","Lovelet AVM Tiyatro Salonu","Samsun","Lovelet AVM Tiyatro Salonu, CANİK, Samsun, Türkiye","41.264999","36.379293","1","1"
"8ef03998-0ee2-467c-9da0-3212e651f84f","Lovelet Avm Salonu","Samsun","Toptepe, Hacı Mansur Sk. No:3 D D:34, 55080 Canik/Samsun","41.26500242","36.37929196","0","0"
"c22b7cde-00b2-46f0-8bbb-031ea1a438b5","Luca's Coffee Karşıyaka","İzmir","Yalı, 6497. Sk. No:12/A, 35590 Karşıyaka/İzmir","38.47252933","27.08598291","0","0"
"667e98c7-69dd-42a0-9bd7-7f8fddcb00e8","Lucca","Samsun","Güzelyalı mahallesi Adnan Menderes, Kısım bulvarı No:2, 55700 Atakum/Samsun","41.35334756","36.24177769","0","0"
"a2316ed4-6969-42f2-b09c-bc98e77ab6c8","Luccas Cafe Bistro","İstanbul","Fatih Mahallesi, Kordonboyu Caddesi 39-B İç Kapı 2, D:2, 34500 Büyükçekmece/İstanbul","41.01731515","28.58952578","0","0"
"8e395a41-2617-4b27-acf8-2ebc57bb4ed1","Lucky Duck Prime Avm","Manisa","Laleli, Ali Rıza Efendi Cd. No:2, 45030 Yunusemre/Manisa","38.61679127","27.39841066","0","0"
"22660a0d-c2f4-4753-9b91-641207c828cb","Lucky's Club","Aydın","Yavansu Mevkii, Süleyman Demirel Blv., 09400 Kuşadası/Aydın","37.82379579","27.25962786","1","1"
"45da3ed6-3d3b-43dc-90ea-6d983c5e6a2b","Lufi Cocktails","Ankara",": Ankara Arjantin Caddesi No:40 C 100. Yıl Mahallesi Gaziosmanpaşa, 06700 Çankaya/Ankara","39.90189556","32.86578949","0","0"
"493e81aa-27c8-41d0-8eb5-e1bb8e3b4dce","Luft","Sakarya","Şirinevler, Adnan Menderes Cd. No:234, 54100 Adapazarı/Sakarya","40.93470214","30.37789841","0","0"
"73c2198f-9a02-4436-81b7-3a90e04099eb","Lujo Hotel Bodrum","Muğla","Lujo Hotel Bodrum, BODRUM, Muğla, Türkiye","37.13762","27.560603","3","3"
"6afe7d08-5d35-45a6-8944-ff35eb75a7fd","Lumina Bar & Kokteyl","İstanbul","Asmalı Mescit, Şehbender Sk. No:18/2, 34430 Beyoğlu/İstanbul","41.02984927","28.97385876","0","0"
"7583b37b-8a2c-4ed5-8145-3c52444667c4","Luna Lunapark","İstanbul","Taşdelen, Şile Otoyolu No:4, 34788 Çekmeköy/İstanbul","41.02988676","29.22165092","0","0"
"6b6fcbf9-7e0c-4945-8448-845836930e82","Lupars Bahçe","Tekirdağ","Hürriyet, Anı Kıyı Sk. No:18, 59030 Süleymanpaşa/Tekirdağ","40.97905928","27.54036096","0","0"
"41620c49-b06e-4b27-bedd-606674db44e2","Lupen Coffee Co","Konya","Bosna Hersek, Osmanlı Cd. No:1/AF, 42100 Selçuklu/Konya","38.01020006","32.52078941","0","0"
"74dcf61a-3a62-45e5-944b-810a17c2e6e8","Luz Nişantaşı","İstanbul","Harbiye, Mim Kemal Öke Cd. No:33, 34367 Şişli/İstanbul","41.04832798","28.99228401","0","0"
"1e76ac78-d8b0-49e1-901e-5436cf75a39c","Luz’s Mansion Bostanlı","İzmir","Bostanlı Mahallesi 1821 Sokak No: 3","38.46035006","27.09787764","0","0"
"bc02b341-619e-4613-99ee-55a8e6a7ca44","Lüleburgaz Yıldızları Sanat Akademisi Budak Çal Salonu","Kırklareli","İstiklal Mahallesi Mehmetçik Caddesi 39750 LÜLEBURGAZ / Kırklareli","41.40080539","27.37483843","0","0"
"494300dd-c064-4c65-a998-09d713a912d8","Lüleburgaz Yıldızları Sanat Akademisi Cahit Irgat Salonu","Kırklareli","İstiklal, Mehmetçik Cd., 39750 Lüleburgaz/Kırklareli","41.39963963","27.37355271","0","0"
"184634e5-3d0c-43a7-a817-49583a471bbc","Lütfi Elvan Fuar ve Kongre Merkezi","Karaman","Elmaşehir Mahallesi, 70200 Karaman Merkez/Karaman","37.15711333","33.23491996","0","0"
"f264f3f8-7502-4e33-bc06-88734e033db9","Lütfi Kırdar Anadolu Auditorium","İstanbul","Harbiye, Darülbedai Caddesi No:4, Taşkışla Cd., 34367 Şişli/İstanbul","41.04757327","28.98950468","0","0"
"6acb1c9e-4e96-4651-a8cb-74431b3ee3b2","L’alibi Meşelipark","Bursa","L’alibi Meşelipark, NİLÜFER, Bursa, Türkiye","40.2257341580511","28.9516902945027","1","1"
"a7ea198e-aebf-44d5-88af-bef6e63e9188","L’avare ALICE","Ankara","L’avare ALICE, ÇANKAYA, Ankara, Türkiye","39.871044","32.682196","1","1"
"f6287dff-26a5-490f-98c3-cb347a625fdf","L’avare Sahne & Sokak","Ankara","Çankaya Mah. Üsküp Caddesi 16/1\nAnkara, Türkiye","39.89471698","32.85806871","0","0"
"e70281e6-de5d-4472-9b57-198269802ed9","MEB Şura Salonu","Ankara","MEB Şura Salonu, BEŞEVLER, Ankara, Türkiye","39.935919","32.825106","4","4"
"b5e3ef7b-b177-4a1b-a48a-15548ee8a1fa","MKM Attila İlhan Salonu","İstanbul","MKM Attila İlhan Salonu, AKATLAR, İstanbul, Türkiye","41.092311","29.027592","1","1"
"f346e8fa-8bb9-4e72-afb9-dd5d8c8ca848","MNG AVM - Sahne Depo","Erzurum","Lalapaşa, MNG AVM, Somunoğlu Cd. D:2.KAT, 25000 Yakutiye/Erzurum","39.91294269","41.25095996","0","0"
"53faae25-265e-4d5e-af1b-6e25ef22fec8","MOC Coffee Roastery","Mersin","Fatih, Adnan Menderes Blv. E Blok No:234 E, 33200 Mezitli/Mersin","36.75613","34.54743","1","1"
"18ba4610-e81b-42e6-b530-3072ee659ef8","MOC Coffee Çorlu","Tekirdağ","Esentepe, Adnan Doğu Cd. 2.sokak no6/4 içkapı no:3, 59850 Çorlu/Tekirdağ","41.15707686","27.84846659","0","0"
"e7ac515c-be63-4003-b8b3-272cdc640480","MOE Açıkhava Sahnesi Yakın Doğu Kampüs - Kıbrıs","Lefkosa","","0","0","7","7"
"e6b0368a-86e5-48ee-aaec-41a3990a5289","MSKM Halit Akçatepe Sahnesi","İstanbul","Örnek Mahallesi, Şht. Cahar Dudayev Cd. No:64, Ataşehir İstanbul","40.99635779","29.08116458","0","0"
"ae3af90b-e532-4211-8cea-a4fdcef266d6","MSV","İstanbul","İstanbul","41.00824791","28.97833215","0","0"
"c7a94dcf-e98f-47e0-933d-586f2b274cda","Mackbear Coffee Co","Karabük","100. Yıl, Kastamonu Yolu, 78050 Merkez/Karabük","41.21661279","32.65935716","0","0"
"3885c973-85d2-4141-b2cc-8acc85bffda4","Mad Monkey Batıkent","Ankara","Kardelen, 2164.cad, 2500 sokak No:29, 06370 Yenimahalle/Ankara","39.98018204","32.70844688","0","0"
"57d6bd6a-3baa-40e1-a782-7c9a05653b8c","Madam Çikolata Güzelbahçe","İzmir","Çelebi, Şht. Kemal Cd. No:95, 35310 Güzelbahçe/İzmir","38.3648711","26.88091375","0","0"
"daea7a7b-f73b-4f70-b17b-4adf94261c3d","Madame Tussauds","İstanbul","Madame Tussauds, BEYOĞLU, İstanbul, Türkiye","41.034651","28.979721","2","2"
"58a24512-d7d6-4039-a3fd-9a0036553a1b","Madhu's Istanbul","İstanbul","Vişnezade, Acısu Sokaği No:19, 34357 Beşiktaş/İstanbul","41.041168","28.9928078","0","0"
"e161243c-2072-4b2f-a936-0f6f61d00f65","Maestro Çanak Cafe","İzmir","Fatih Mahallesi, Oruç Reis Caddesi Çanak Sitesi no:207 Foça - İzmir","38.73510322","26.76691018","0","0"
"f4cd107f-6313-4b29-b425-6ac7c1c42a69","Mahalle Güzelbahçe","İzmir","Yalı, Abdullah Baydar Cd. No:36, 35310 Güzelbahçe/İzmir","38.37197259","26.90078502","0","0"
"9077aa9a-7384-43ef-8e5d-ed45abc39ad4","Mahfel Urla","İzmir","Yeni, Filiz Sk. No:6, 35430 Urla/İzmir","38.34018606","26.75710983","0","0"
"9b2fdcaf-d8ec-41aa-8afe-5b6179b25c3f","Mahfil Sahne","Eskişehir","Hoşnudiye, Mustafa Kemal Atatürk Cd No:190/D, 26130 Tepebaşı/Eskişehir","39.78476859","30.50707471","0","0"
"99484c2a-8f26-4f15-ae55-da3da32b28e5","Mahfil Sahne","Eskisehir","Hoşnudiye, Mustafa Kemal Atatürk Cd No:190/D, 26130 Tepebaşı/Eskişehir","39.7791293","30.5060482","0","0"
"c787400f-3c21-4680-98c5-e3ca03632e2f","Mahsus Sahne","İstanbul","Mahsus Sahne, ŞİŞLİ, İstanbul, Türkiye","41.1150181207527","28.9995599588967","7","7"
